{
  "contract": "review-loop-reopen-record-v1",
  "target_ref": "workflow:standalone-challenger-reopen-close",
  "reason_code": "challenger_reopen",
  "recorded_at": "2026-04-15T10:18:00Z",
  "promoted_working_agent_id": "fixture-challenger-reopen-1",
  "prior_challenger": {
    "agent_id": "fixture-challenger-reopen-1",
    "findings_path": "challenger/attempt-1/findings.json",
    "verifier_evidence_path": "challenger/attempt-1/verifier-evidence.json"
  }
}
